{
    "$id": "https://githb.com/jtschichold/mm-cloud-services-miners/RADBASRegisterdRoutesMiner.schema.json",
    "$schema": "http://json-schema.org/draft-07/schema#",
    "type": "array",
    "minItems": 1,
    "items": {
        "type": "object",
        "properties": {
            "route": {
                "type": "string"
            },
            "descr": {
                "type": "string"
            },
            "origin": {
                "type": "string"
            },
            "mntBy": {
                "type": "string"
            },
            "source": {
                "type": "string"
            }
        },
        "required": ["route", "origin", "source"]
    }
}